,ID,text
107,l-D0uS-tgmhkFpHKBXvPQA,"Lets admit place neither Chinese Mexican. Not I problem that. I see another Panda Express Baja Fresh good ole American fast food. I twice food good times. I tried jade red chicken, emerald chicken, machaca, carnitas, cuban black beans, refried beans, pork fried rice. My favorites jade red chicken pork fried rice. On second visit, food little salty, again, American fast food. The snickerdoodle cookie also nice touch. I need sure make one day volcano cookie. Portions big enough leftovers another meal. This granted I always pick quesadilla one combo choices. Service good visits even though workers seem little young. They friendly, helped menu, gave samples first timers. I admit, 10 combo drink high fast food joint, somehow, I know I going back. Oh yeah, 10, better plastic lawn chairs tables."
108,l-D0uS-tgmhkFpHKBXvPQA,"So bf I went new location Chandler. It set back road slightly hidden, bit hard find. The inside huge. Like warehouse. The walls lined plastic outdoor tables chairs. Kind weird whatever. The food INTERESTING. Some things I tried good good. I Red Chicken, Diablo quesadilla Jerk Fried Rice. The Diablo chicken incredibly salty greasy. I would order again. The Red Chicken bomb! And Jerk Chicken alone amazing. I also tasted Emerald Chicken good, weird. My bf loved Jerk Chicken Red Chicken. I would definitely go back try things. I love variety. And price really great deal. You get lot food drink 10! If looking something cheap lots options I would recommend it! If mom town visiting, take somewhere bit nicer."
109,dnB7SD38_lwiC9E-BJxq-Q,"Love supporting small businesses Im glad I found little place so! Food delicious, I tried little.of everything pastries point. I enjoyed all, even mac cheese! The owner sweetheart well working alone Friday night! Thats great commitment I back sure!"
110,l-D0uS-tgmhkFpHKBXvPQA,"Been numerous times, usually Id rate 4 5. Lately, however, appears management never duty. They slow inattentive. I called ahead large party around 20 people nearly week advance, hours alotted time. Upon arrival, tables neatly set aside marked reserved. However, cooks didnt show work, management didnt see point two Saturday night. It took hour us get food. AN HOUR! The place slammed, good them, watched customers ended leaving instead staying waiting hour food. The wait ridiculous, especially since arrived scheduled time number people said would have. Ive never original Chino Bandido, apparently one isnt able accomodate groups size reasonable time period. This second time brought group Chino, I guarantee last."
111,l-D0uS-tgmhkFpHKBXvPQA,"So Ive going Chino Bandido place number years. Great concept ChineseMexican Confusion without pretense. At original location horsey races give Chino Bandido virgins whole flavor sample deal almost get full meal trying different possible fillings. So Chandler location I didnt notice whole ritual. It figure want fill order sheet. The order sheet seems trip lot folks. It aint rocket science quantum finance, folks. Dont even look sheet. Figure want eat first look sheet see photo figure express that. Its easy. You get 14 items choose Carnitas, Chile Relleno, Chinese BBQ Pork, Egg Foo Yung, Gringo Chicken, Hengrenade Chicken, Jade Red Chicken, Jen Red Pork, Jerk Chicken, Emerald Chicken, Teriyaki Chicken, Veggie Salad, Pollo Diablo, Machaca. Got Now choose get rice bowl, combination, Quesadilla, Burrito. For rice bowl, choose one item steamed rice optional beans well. You also add fried rice 75 cents. For combo, choose two different items says 120 I think meant 14 circle either BLK Black REF refried beans. Then also choose type fried rice want. JFR Jerk Fried Rice, CFR Chicken Fried Rice, PKFR pork fried rice, PLFR plain fried rice. This pretty much fullon big plate. You also get items either burrito quesadilla specifying Q B. This way get burrito quesadilla addition fried rice beans. You also get items Quesadillas. You mix one item together youre daring. Same burritos. You also order rice beans separate side didnt get rice bowl combo wanted anyway. You get pint quart well want take home. Finally, cookies. You get free cookie anyway one aint enough space order half dozen dozen. Drinks pretty much self explanatory. I like place. I dont need endorsement Guy Fieri justify liking place. This occasional lunch outing coworkers mood strikes. Lately Ive getting Quesadillas Burritos skipping whole rice beans thing. I dont need fall asleep meetings thank you. One thing location even though dont need higher education fill order form might still need sextant, compass, telescope, charts find place. The Google map makes look like right Chandler deep southeast mall. Lots parking necessarily right next place lunch rush."
112,dnB7SD38_lwiC9E-BJxq-Q,"Everything made squares. The croissant buttery tasty. I also tried one spinach pies, flavorful, still good! Staff helpful friendly"
113,EAs61Wm1O6tLjCs8t2eP-Q,"Great location Goodyear. Restaurant clean indoors outdoors. We seated right away young waitress quick, kind zero mistake. My girl ordered veggie fried rice veggie lo mein. She also egg drop soup liked it. She satisfied! For appetizer, I ordered pan fried chicken potstickers. The potstickers average. They werent juicy, tender warm expected. For main entree, I got orange chicken dinner combo came fried rice, lo mein, one egg roll two crab puffs. All delicious. The orange chicken thinly sliced sauce uniquely delicious. The lo mein best Ive had, EVER! Staff works hard proud business. I definitely come back!"
114,l-D0uS-tgmhkFpHKBXvPQA,"Chino Bandido best of... best kind. As restauranteatery fuses chinese, mexican jamaican metal dish togo, Chino Bandido unique Phoenician experience. While get sort memorable experience decor, remember intricate coded system ordering enigmamenu, way dish looks comes mexican beans, jerk chicken, red jade pork, fried rice. If love basic combination Meat Rice, heaven. If want Jamaican jerk chicken pork fried rice thrown burrito it. You look overhead board menu choose basic options, real Chino Bandido experience occurs take second learn menu code, create combo. Choose two numbers 112 meat, either black refried beans, selection rice pork, chicken, fried, jerk, spanish oh, want thrown metal tin, prepared burrito quesadilla... Yeah, dont order 2. Make something own. The space nearly large school cafeteria tables would fit perfectly setting. Grab pen menu ordering counter sit party fill neatly circle items want. Hand order thats it. Theyll decipher code bring food. The Chandler location free WiFi, youll see good number IT personnel lunch, sitting laptops working. The food Chino Bandido really good. Especially much get low price. There isnt anything like anywhere else Phoenix. While describe fusion three types food, honestly that. Just throw bowl, doesnt make fusion. Chino Bandido fulfills cravings, them, once. Want chinese mexican little jamaican Right Okay! Go here. Although better actual restaurants, Chino Bandido definitely better fast lunch spots. I could seriously eat everyday months dish. As far uniquely Phoenix experience, that, must. When start actually create items mashing things together... itll Phoenix Must. Until then, one best quick lunches get."
