ID,text,neutral
l-D0uS-tgmhkFpHKBXvPQA,"So I've been going to this Chino Bandido place off and
on for a number of years. Great concept - Chinese/Mexican
(Con)fusion without any pretense. At the original location
by the horsey races they give Chino Bandido virgins the
whole flavor sample deal - you almost get a full meal just
trying all the different possible fillings. So in this
Chandler location I didn't notice that whole ritual. It
is more of just figure out what you want and fill out the order
sheet. 
   The order sheet seems to trip up a lot of folks.
It ain't rocket science or quantum finance, folks. Don't
even look at the sheet. Figure out what you want to eat
first and then look at the sheet (see photo) and figure out 
how to express that. 
  It's easy. You get 14 items to choose from: Carnitas, Chile
Relleno, Chinese BBQ Pork, Egg Foo Yung, Gringo Chicken, Hengrenade
Chicken, Jade Red Chicken, Jen Red Pork, Jerk Chicken, Emerald
Chicken, Teriyaki Chicken, Veggie Salad, Pollo Diablo, and Machaca.
Got all that? Now you can choose to get this as a rice bowl, 
combination, Quesadilla, or Burrito. 
   For the rice bowl, you just choose one item with steamed rice or
optional beans as well. You can also add fried rice for 75 cents.
   For the combo, you can choose two different items (it says 1-20 
but I think they meant 14) and circle either BLK for Black or REF for 
refried beans. Then you also choose what type of fried rice you want. 
JFR for Jerk Fried Rice, CFR for Chicken Fried Rice, PKFR for pork 
fried rice, and PLFR for plain fried rice. This is pretty much the 
full-on big plate. You can also get the items in either a burrito or 
a quesadilla by specifying a Q or B. This way you get a burrito or
quesadilla in addition to your fried rice and beans. 
   You can also get items as Quesadillas. You can mix more than one
item together if you're daring. Same with the burritos. 
   You can also order the rice and beans as a separate side if you 
didn't get the rice bowl or combo and wanted it anyway. You can get
it as a pint or quart as well if you want to take some home.
   Finally, the cookies. You get a free cookie anyway but if one ain't
enough they have a space for you to order half a dozen or a dozen.
   Drinks - pretty much self explanatory. I like this place. I don't need
an endorsement by Guy Fieri to justify my liking this place. This is 
an occasional lunch outing with co-workers when the mood strikes. Lately
I've just been getting Quesadillas and Burritos and skipping the whole
rice and beans thing. I don't need to fall asleep in any meetings thank
you. :) One thing about this location - even though you don't need 
higher education to fill out the order form you might still need a 
sextant, compass, telescope, and charts to find the place. The Google
map makes it look like it is right on Chandler but it's deep southeast 
into the mall. Lots of parking but not necessarily right next to the
place during the lunch rush.",positive
dnB7SD38_lwiC9E-BJxq-Q,"Everything is made as squares. The croissant was buttery and tasty. I also tried one of the spinach pies, not as flavorful, but still good! Staff is helpful and friendly",positive
EAs61Wm1O6tLjCs8t2eP-Q,"Great location in Goodyear. Restaurant was clean indoors and outdoors. We were seated right away by a young waitress who was very quick, kind and zero mistake. My girl ordered veggie fried rice and veggie lo mein. She also had my egg drop soup and liked it. She was very satisfied!

For an appetizer, I ordered pan fried chicken potstickers. The potstickers were average. They weren't as juicy, tender and warm as expected. For my main entree, I got the orange chicken dinner combo which came with fried rice, lo mein, one egg roll and two crab puffs. All were delicious. The orange chicken is thinly sliced and the sauce is uniquely delicious. The lo mein has the be the best I've had, EVER!

Staff works hard here and their proud of he business. I will definitely come back!",positive
l-D0uS-tgmhkFpHKBXvPQA,"Chino Bandido is the best of... the best of it's kind. As a restaurant/eatery that fuses chinese, mexican and jamaican all into the same metal dish to-go, Chino Bandido is a unique Phoenician experience. While you will not get any sort of memorable experience from the decor, what you will remember is the intricate coded system of ordering from their enigma-menu, and the way your dish looks when it comes out with mexican beans, jerk chicken, red jade pork, and fried rice. If you love the basic combination of Meat + Rice, this is heaven.

If you want Jamaican jerk chicken and pork fried rice thrown into a burrito - do it.

You can look at the overhead board menu and choose from the basic options, but the real Chino Bandido experience occurs when you take a second to learn the menu code, and create your own combo. Choose two numbers 1-12 as meat, then either black or refried beans, then from a selection of rice - pork, chicken, fried, jerk, spanish - oh, and if you want it just thrown into the metal tin, or prepared as a burrito or quesadilla... Yeah, don't just order the #2. Make something your own.

The space is nearly as large as a school cafeteria and the tables would fit perfectly in that setting. Grab a pen and menu from the ordering counter and sit down with your party while you fill it out neatly and circle the items you want. Hand it over when you order and that's it. They'll decipher the code and bring you your food.

The Chandler location has free WiFi, and you'll see a good number of IT personnel at lunch, sitting with their laptops and 'working'.

The food at Chino Bandido is really good. Especially for how much you get for the low price. There isn't anything like this anywhere else in Phoenix. While some describe this as a 'fusion' of the three types of food, it's honestly not that. Just because you throw them in the same bowl, that doesn't make it fusion. Chino Bandido fulfills cravings, all of them, all at once. Want chinese or mexican or a little jamaican? Right now? Okay! Go here. Although not better than most actual restaurants, Chino Bandido is definitely better than most fast lunch spots. I could seriously eat here everyday for a few months and not have the same dish.

As far as a uniquely Phoenix experience, it is that, but it's not a must. When they start to actually create items and mashing things together... then it'll be a Phoenix Must. Until then, it's just one of the best quick lunches you can get.",positive
